Nome Exposição,Data de Início,Data de Fim,Texto,Artista(s)
Incursões Pictóricas,14/01/2012,03/03/2012,"Este trabalho resulta de insistentes experiências levadas a cabo na prática oficinal ao longo dos últimos anos, São autênticas incursões plásticas que resultam duma atitude aventureira, e cuja incerteza no resultado final levanta a natural dúvida. O conjunto dos trabalhos diverge na sua arquitectura plástica pela forma como é abordado. Para além do meu léxico próprio no tratamento da figura humana, mostro também um grupo de figuras típicas, imagens do nosso quotidiano, autênticos ícones na nossa sociedade ocidental: imagens que encontramos a toda a hora...A completar o conjunto abordo a pintura de pequeno formato, contrariando o lema “big is beautiful” e realçando o (...)

Nuno San-Payo",Nuno San-Payo
"Exposição Colectiva De Pintura, Escultura E Cerâmica",08/12/2011,31/12/2011,"EXPOSIÇÃO COLECTIVA DE PINTURA, ESCULTURA E CERÂMICA","Alexandre Cabrita, Armanda Passos, Carlos Marques, Clara Vicente, Daniel Africano, Emília Viana, Filipa Sottomayor, Franchini, Helder De Carvalho
Helena Pedro Nunes, João Cutileiro, João Noutel, Manuela Mendes Da Silva, Mafalda Mendonça, Mariana De Castro, Patrícia D'Orey, Ricardo Passos, Ricardo Tadeu, Rodrigo Alzamora"
Out Series,03/11/2011,03/12/2011,"É muito irónica a arte feita assim, com esta componente luxuosa dos materiais em redor de uma perspectiva de contemporaneidade que não nos gratifica, antes nos instiga a repensar as coisas, como se nos obrigasse a sair de um mundo de generalizações para nunca mais podermos generalizar. (...)

valter hugo mãe",João Noutel
Facetas,17/09/2011,22/10/2011,"Quem se propõe olhar para a obra de Gustavo Fernandes verifica desde logo que o artista tem uma capacidade de representação do real extremamente notável, sobretudo quando se trata de um autor que se pode gabar de ter construído a sua formação, não através de estudos convencionais, mas num percurso muito próprio junto dos que considerava mestres, os que entendeu que lhe podiam trazer mais-valias importantes, como Francisco de Oliveira, mas também em significativas academias internacionais como o Dawson College, sendo ainda de registar uma aprofundada pesquisa na esfera das técnicas do desenho segundo o método proposto por Kimon Nicolaïdes, uma das mais importantes referências na área. 

Paulo Morais-Alexandre",Gustavo Fernandes
Exposição De Pintura,17/09/2011,22/10/2011,"Pedro Pinto Coelho desenha à maneira realista com notável perfeição, enquanto a sua pintura se distancia de figurar as coisas como elas são ou como poderiam ser.
Pedro P.C. deixa-se levar pelas suas próprias visões, visões estas que nos aproximam da realidade e que depois nos transportam para outras fronteiras.
(...)

Adolfo Castaño",Pedro Pinto Coelho
Intencidade,09/07/2011,10/09/2011,"A “Cidades do Meu Pais”,”Estações do Ano”, ”Marinas”, ”O Porto”, ”Naturezas Mortas”, são apenas algumas das propostas que Ana Medeiros tem vindo a apresentar ao longo do seu jovem percurso enquanto pintora. Nestas,assim como no restante da obra, constata-se uma transformação do real de forma endógena, fruto de uma
grande experiência e de um grande amadurecimento enquanto pessoa.",Ana Medeiros
Retrosarias Almada,09/07/2011,10/09/2011,"Escrever sobre um trabalho realizado é uma tarefa difícil.
É difícil porque já perdi o distanciamento saudável para avaliar o meu trabalho.
Mas posso dizer que me propus a fazer algo inovador. Inovador, pelo menos, para mim pois ainda não o tinha experimentado. Transportar objectos tridimensionais para uma tela, onde à partida se pinta.
Também posso falar acerca do meu fascínio pelas retrosarias e pelas lojas de ferragens, espalhadas pelo centro do Porto… De ficar sem saber onde pousar os olhos, de percorrer as paredes onde inúmeros objectos, cores, formas e texturas se dispõem de forma irregular, no entanto, coesa.

Maria Portugal",Maria Portugal
Exposição Colectiva Fozarte 2011,04/06/2011,02/07/2011,"Exposição de homenagem a Carlos Lança com a participação de 25 artistas

FOZARTE 2011· CARLOS LANÇA
ROTARY CLUBE PORTO-FOZ
Dando continuidade à FOZARTE IV, realizada em 2008, o Rotary
Clube Porto-Foz leva a efeito, entre os dias 4 de Junho e 2 de
Julho de 2011, na Galeria Ap’arte , a FOZARTE V, certame que
visa expor obras de reputados artistas de dimensão nacional,
com o objectivo de obtenção de fundos destinados ao programa Banco Alimentar de Proximidade, mais premente do que
nunca, em curso no nosso Clube. ","Abreu Pessegueiro, Acácio De Carvalho, Alfredo Barros, Américo Moura, Ana Maria, Ariosto Madureira, Benvindo De Carvalho, Carlos Dos Reis, Carlos Marques, Daniel Africano, Eduardo Nery, Eduardo Verde Pinho, Fernando Gaspar, Filipa Sottomayor, Franchini, Helena Abreu, José António Nobre, José Emídio, José Rodrigues, Luísa Gonçalves, Mafalda Mendonça, Mário Ferreira Da Silva, Nadir Afonso, Nuno San Payo, Silva Lima"
Relicarium,30/04/2011,21/05/2011,"Respirar Criatividade

""Talento, criatividade, empenhamento, dinâmica e força de vontade são as caracteristicas que considero indispensáveis para o futuro promissor de um artista. Apesar de ainda jovem, Diogo Goes tem, ai qte tudo indica todas estas vertentes e o seu trabalho já fala por si. Optando por um caminho muito peculiar tem sempre a preocupação, antes de construir a obra, de criar o conceitoem que esta assentará. É um princípio que teima em levar por diante.(...)""

Agostinho Santos",Diogo Goes
Território Cúmplice,30/04/2011,21/05/2011,"""Uma conjugação de vários registos de círculos de experiências segundo vários modelos visuais - objectos assistidos, escultura, pintura sobre telas de diferentes dimensões e formas: em íntima ligação com as formas-suportes da pintura, os trabalhos de Agostinho Santos agora apresentados configuram um registo possível de alguns lugares-sensações, localizando Identidades, Olhares, Mensagens, Viagens, Paisagens, Labirintos… Serão reconstruções ou inscrições que se deixam emoldurar, planeando fugir e dissolver-se entre os recursos expressivos…""

Prof. Dra. Maria Leonor Soares",Agostinho Santos
Primavera,12/03/2011,23/04/2011,"Esta exposição surge no seguimento da obra que venho a executar ao longo destas duas ultimas décadas, tendo como fio condutor a necessidade constante de transmitir sentimentos e energias relacionadas com a Natureza.
O importante é o trabalho que ganha identidade e vida própria, sugerindo comportamentos com leituras tácteis e visuais..
Uso o espaço, o conhecimento e o meu limite de liberdade para realçar formas, texturas, sombras e luzes.
Em todas as composições dos meus quadros existe acima de tudo expressão. Trabalho sempre para além da própria exaustão, tentando superar-me a mim mesmo.
",Jorge Curval
Transgressão Voluntária,11/02/2011,05/03/2011,"Franchini em sua inquietação busca novos resultados mesclando várias técnicas para poder transmitir confortavelmente sua arte , e é na experimentação das diversas técnicas e linguagens que encontra conhecimento somado à sua sensibilidade resultando em uma obra sem fronteiras.

Fernando Durão",Franchini
Chá Verde,11/02/2011,05/03/2011,"A pintura de Mariana de Castro recupera os valores femininos, representados através de uma visão pessoal e contemporânea, rompendo a barreira do real, mostrando a sua visão do mundo, contra o realismo e a lógica.

Filomena Castro Alves",Mariana De Castro
Texturas,11/02/2011,05/03/2011,"Em Manuela Mendes da Silva a pintura está sempre presente pela sugestão da textura, é certo, mas também pela revelação do processo. Todavia, existe uma espécie de gesto primordial que se suspeita e se insinua pela sistemática repetição de movimentos, em obstinado desejo de fazer erguer realidades novas e distintivas. Algum do ideário de teor romântico persiste, ainda assim, na medida em que uma suposta percepção de que a ´ruína´ e o ´resto´ é o que salva, ou permite sobreviver, a pintura e a arte.

António Quadros Ferreira",Manuela Mendes Da Silva
Black People Reincarnation,15/01/2011,05/02/2011,"Os trabalhos de Ilídio Canja, apresentam publicamente o modo como este jovem pintor busca incessantemente o seu espaço próprio, o sentido endógeno para a sua pintura. A luta que a sua pintura apresenta, entre a cor, a composição, a textura, o acaso, o fazer e o refazer, correspondem a essa procura, que nunca se encerra...

José Paiva",Ilídio Candja
Sinais,15/01/2011,05/02/2011,"Os sinais, alertas e avisos das opções que seguimos na vida estão sempre no nosso quotidiano. Por opção própria, refúgio, ou seja por que motivo for, nós não lhes prestamos atenção e fazemos exactamente o que bem queremos… mas os sinais estão lá!!! Nestas telas misturo estes sinais com a sensualidade de olhares que, apesar de sem som, gritam com a expressão o que sentem, o que fazem, o quanto provocam…

Patrícia D'Orey",Patrícia D'Orey
"Exposição De Pintura,
Escultura E Cerâmica",08/12/2010,31/12/2011,"EXPOSIÇÃO DE PINTURA, ESCULTURA E CERÂMICA
","Ana Maria, Antónia Gomes, Armanda Passos, Clara Vicente, Daniel Gamelas, Emília Viana, Franchini, Gracinda Candeias, Jaime Isidoro, Jesus Castonon, João Carqueijeiro, João Cutileiro, João Noutel, Mafalda Mendonça, Mariana De Castro, Sousa Pereira"
Aeris,06/11/2010,04/12/2010,"""Gracinda Candeias, é uma pintora marcada pela consciência espacial que trouxe de África e com o contacto com o Oriente, compreendeu um outro espaço, percebeu o equilíbrio espacial que a levou para a consideração do espaço já não Africano nem Europeu e sim para um espaço diferente....
Em toda a sua pintura que é mais Oriental quanto possível numa pintora Ocidental, entendeu nas vivências espaciais e o que vem fazendo é considerada uma pintora original e que tem já o seu lugar na História da Pintura Portuguesa...""

José Augusto França",Gracinda Candeias
Tatuagens Da Alma,18/09/2010,30/10/2010,"Uma viagem pelas memórias indeléveis de outros tempos e espaços cujos símbolos nos marcam e permanecem no nosso tempo e espaço.
Viajamos no espaço e no tempo sem sabermos porque existimos e como existimos…
Pequenos fragmentos numa imensidão que não se vê, apenas separados uns dos outros por um invólucro que é a nossa pele que nos limita e condiciona como um casulo. Vemo-nos nascer, crescer, envelhecer , morrer sem nunca entendermos porquê ou para quê, porque simplesmente nos limitamos a existir. Viramos as esquinas da vida e de repente, uma imagem, um desejo, um sonho já vivido em algum lugar, em algum tempo, sabe-se lá onde, não sabemos, mas existiu .

Rita Pessanha",Rita Pessanha
Erro,18/09/2010,30/10/2010,"Um elogio ao ""Erro"" ou o que se interpreta por erro, à imprevisibilidade e às imperfeições. A distância entre aquilo que se prevê, o processo e o resultado, alimentado pela beleza do incerto. A beleza do Erro.
","Maria Helena E
João Bento Soares"
Exposição De Pintura E Colagens,10/07/2010,11/09/2010,"“Trata-se de uma estética que é absolutamente moderna e pertence já ao século XXI. Pertence sem dúvida ao Futuro.”
(Paulo Morais – Crítico de Arte; professor de “Problemas da Arte Contemporânea” na Escola Superior de Teatro e Cinema)
“A sensação “out of real” provém do mimetismo que povoa as suas obras, as personagens são credíveis no significado mas improváveis das mais inusitadas maneiras, surgindo com formatos quase alienígenas que se movem num espaço e tempo diferentes por entre a articulação de formas e cores provenientes da colagem e da pintura”.
(Sandra Archibald)

Paulo Morais e Sandra Archibald",Filipa Sottomayor
Exposição Colectiva ,10/07/2010,11/09/2010,"MOSTRA COLECTIVA DE PINTURA
DE ARTISTAS CONTEMPORÂNEOS","Ana Medeiros, Leonor Taborda, Mafalda Mendonça, Maria João Brito E Cunha, Maria Portugal, Patrícia D'Orey, Pedro Guimarães, Silva Lima"
Conversas No Ar,05/06/2010,03/07/2011,"Carta a uma jovem artista
O que se espera ver quando se vê pela primeira vez o portfolio de um jovem artista que nos elogiaram? Energia, alegria, velocidade de soluções, trabalho intenso e continuado... Tudo o que Filipa Saragga demonstra possuir – eu diria mesmo, tudo o que mostra desejar perseguir.
O que não importa que esse trabalho ainda revele? Alguma ingenuidade – porque sabemos (desde Almada) que a ingenuidade é matriz do espanto e que é o espanto que nos abre os olhos para o Mundo. Algum excesso de caminhos – porque sabemos que a curiosidade é a porta que nos tira da disciplina cega e nos ajuda a conquistar o Mundo. E, a um jovem artista, apenas se deve exigir que abra os olhos para (...)

João Pinharanda",Filipa Saragga
Oficina 2000&5,17/04/2010,29/05/2010,"Mostra colectiva de cerâmica de autor da OFICINA 2000&5
","Franchini, Moreira Da Silva, Emilia Viana, Sobral Centeno, Francisco Laranjo, Márcia Luças, Silvia Carreira, Albuquerque Mendes, Henrique Do Vale, João Carqueijeiro "
Série Corpos / Série Elas,17/04/2010,29/05/2010,"Em espaços de liberdade criativa assumidamente emotiva, em segredos de imagens que contaminam o esplendor da invenção artística, em rasgos de transcendência incontida espelhada em sucessivas explosões de sensações, Eduardo Verde Pinho doa-nos pinturas que não são passivas gotas de orvalho, mas torrencial chuva estética que emancipa a indiferença e projecta o observador na racionalização das próprias pulsões do inconsciente.
Desenhando directamente na tela as cores ao pincel, de forma que a linha é pintura e desenho em harmonia visual pura, Eduardo Verde Pinho procura, na primeira fase da sua obra, captar, com despreocupação de perfeição e sem tibiezas de estilo, a provocação arrojadamente (...)

Delfim Sousa",Eduardo Verde Pinho
Nadir Ou A Pintura Como Pura Sugestão,06/03/2010,10/04/2010,"É curioso, porém, compreender hoje de que modo a obra de Nadir evoluiu de novo no decurso das últimas duas décadas. De facto, tendo feito um longo percurso no campo de uma cada vez maior depuração formal, que se poderia quase entender como a passagem de um período analítico para um outro, de perfil mais sintético, a obra de Nadir pôde conhecer um novo momento de invenção plástica de que as suas obras recentes são testemunho.
Refiro-me à capacidade de passar desse registo abstracto que a definiu durante algumas décadas para um outro, de mais incerta classificação, em que podemos voltar a ter uma vertigem de figuração. Chamo-lhe ""vertigem"" precisamente porque se trata do emprego propositado (...)

Bernardo Pinto de Almeida",Nadir Afonso